,title,content
0,"Michael Goodwin: Trump is someone you need to work with, Democrats. It's time for Washington to come together","Michael Goodwin says Donald Trump is a president who likes to make deals.Over nearly two decades, several Israeli leaders offered peace terms that included a Palestinian state. The offers were rejected, a rain of Arab rockets and terror attacks followed and across the Israeli political spectrum, there was one reaction: We don&#x2019;t have a partner for peace.President Trump knows the feeling.His&#xA0;remarks following the horrific attacks in El Paso and Dayton&#xA0;hit all the right notes. He forcefully condemned bigotry and white supremacy and touted measures aimed at flagging potential mass murderers before they get guns."
1,"Jason Chaffetz: To stop more shootings, stop erasing criminal records of juveniles prone to violence","After the mass shooting in Dayton, Ohio, Fox News contributor Jason Chaffetz argues that law enforcement should have access to juvenile records to prevent more violence.The mass shooter in Dayton, Ohio who was killed by police early Sunday after he shot nine people to death and wounded more than a dozen fit the now-familiar profile of the troubled youth with a well-documented history of threats dating back to high school.The Dayton gunman had a &quot;kill list&quot; and had interacted with law enforcement as a minor, authorities said.Similarly, the man charged with killing 17 people and wounding 17 others at Marjory Stoneman Douglas High School in Parkland, Fla., last year was also well known to high school counselors and local police before he turned 18, police said."
2,"Todd Starnes: Country music going liberal? Sweet mercy, let's hope it's not getting Dixie-Chick-a-fied","Country music singer Kacey Musgraves urged fans in Chicago to chant 'somebody f—king do something' following the mass shootings in Dayton, Ohio, and El Paso, Texas.I recently received a rather urgent telephone call from my beloved Aunt Lynn, the church pianist down at the Methodist church in Mississippi.&#x201C;Todd, what in the name of Minnie Pearl is going on with country music,&#x201D; she demanded to know. &#x201C;The girls in our Bible study class think they&#x2019;re going liberal.&#x201D;CLICK HERE TO PRE-ORDER TODD&#x2019;S EXPLOSIVE NEW BOOK, &#x201C;CULTURE JIHAD: HOW TO STOP THE LEFT FROM KILLING A NATION.&#x201D;"
3,"WSJ: The Dayton killer was a left-winger, but don't blame Elizabeth Warren","The gunman killed nice people in 30 seconds before officers killed him; Mike Tobin reports.Police in Dayton say they&#x2019;re still seeking a motive for Connor Betts&#x2019; shooting spree that killed nine people, including his sister. But whatever turns up, we hope no one blames Elizabeth Warren.We say that because the news site Heavy.com, which gained access to Betts&#x2019; Twitter account before it was taken down, reports that his politics appear to have been left of center. The shooter recently tweeted that he would &#x201C;happily&#x201D; vote for Senator Warren. His Twitter profile also read: &#x201C;he/him/anime fan/metalhead/leftist/i&#x2019;m going to hell and i&#x2019;m not coming back.&#x201D; In December last he wrote: &#x201C;This is America: Guns on every corner, guns in every house, no freedom but to kill.&#x201D; A month before that, he wrote: &#x201C;Vote blue for gods sake.&#x201D;The Dayton shooter’s leftist ravings are notable only because the media and Democratic politicians have drawn a straight line between the El Paso shooter’s anti-immigrant “manifesto” and Donald Trump and the Republican Party.CLICK HERE TO GET THE FOX NEWS APP"
4,"Bradley Blakeman: It's time for gun safety, increased mental health care – Let's come together America","The 'Outnumbered' panel reacts to the political divisiveness coming from Democrats in the aftermath of the tragedies in Texas and Ohio.Now is the time for our nation to come together and tackle gun safety and mental health screening and treatment in a meaningful way.There are an estimated 300 million+ firearms in America today. It is unreasonable and more importantly unconstitutional to confiscate weapons out of hand. But, it is reasonable and constitutional to regulate them.Now is the time to institute national and uniform background checks prior to the purchase of firearms. We must change and close loopholes that cover gun-shows and person to person sales."
5,Alfredo Ortiz: In the Trump economy small businesses are thriving -- So why are Dems working to undermine it?,"White House trade adviser Peter Navarro addresses the intensifying trade tensions on 'America's Newsroom' after the Dow's worst trading day of the year.It&#x2019;s a sad fact but many national news outlets blatantly ignore how President Trump has done a great deal to revive and grow the economy and help small businesses prosper by increasing access to affordable, reliable energy.Under President Trump, the U.S. is experiencing record-low unemployment and rising wages the previous administration repeatedly said wasn&#x2019;t possible. As a result, small businesses are hiring at a record pace and President Trump&#x2019;s goal of energy dominance has played a big part in this economic expansion. Rather than restrict energy production, Trump policies are creating record production of oil and natural gas, which in turn are stabilizing energy prices and costs for companies.These stable or reduced fuel costs are especially beneficial to small businesses which are responsible for creating 62 percent&#xA0;of the jobs in the American economy. When small business owners pay less to power their operations or transport goods, they can grow, they can hire more people or pay higher wages to existing employees."
6,"Gary Brubaker: El Paso, Dayton -- 'Monopoly' doesn't create slumlords. Video games don't school sociopaths","Rod 'Slasher' Breslau says politicians are perpetuating the myth that games inspire young Americans to commit violent acts.Personally and corporately as a nation, we recoil in horror and grief at the continued gun violence in the United States.Politicians want to seek solutions that will make a meaningful difference. A number of our national and state leaders allege that playing video games can change people into criminals capable of carrying out mass shootings.&#xA0;The theory being that playing video games can cause psychological breaks in otherwise non-violent individuals. That violent video games not only train people for murder, but create sociopaths. Therefore, violent video games are a root cause of our prolonged nightmare of large-scale shootings.I have been a video game developer for over two decades and have been a faculty member at the world&#x2019;s leading video game development graduate program, SMU Guildhall in Dallas, for over a decade. I have been on teams that authored best-selling titles and have taught current leaders in the industry at the graduate level."
7,Gutfeld on the media's polarizing attacks,"Media continue to smear Trump after mass shootings.The media continue to use tragedy to indulge their own resentment.First, there&apos;s Nicole Wallace of MSNBC claiming President Trump said he wanted to exterminate people.Wallace said: &#x201C;You now have a president &#x2026; talking about exterminating Latinos.&#x201D;"
8,Newt Gingrich: Left viciously attacks McConnell because he’s successful Senate leader and Trump ally,"Left launches attacks against McConnell, New York Times; reaction from 2008 presidential candidate Dennis Kucinich and American Conservative Union Chair Matt Schlapp.Senate Majority Leader Mitch McConnell has proven himself a master of both the Senate and the judicial branch.McConnell was elected to the Senate in 1984 and is the longest-serving U.S. senator to ever represent Kentucky. He was elected Republican Senate leader in November 2006 and is today the longest-serving Republican Senate leader in history.The story of McConnell&#x2019;s steady and relentless rise to power is best understood by reading his own memoir,&#xA0;&#x201C;The Long Game.&#x201D; He is candid and practical in exactly the down-home way he runs the Senate and his campaigns."
9,Andy Puzder: Blame China's broken promises for Trump imposing tariffs,"White House trade adviser Peter Navarro joins Chris Wallace on 'Fox News Sunday.'President Trump&#x2019;s strategic counter-tariffs on China have been deliberate, predictable and business-like &#x2013; contrary to Beijing&#x2019;s series of broken promises and the self-serving misinformation that China&#x2019;s state-run media are peddling.The president recently announced that the U.S. will follow through to implement a 10 percent tariff on $300 billion worth of Chinese imports Sept. 1. The10 percent tariff had been put on hold earlier this year after a personal meeting between Trump and Chinese President Xi Jinping.The Chinese government is now attempting to portray President Trump&#x2019;s action as erratic and capricious, but nothing could be further from the truth."
10,"Michael Goodwin: Trump is someone you need to work with, Democrats. It's time for Washington to come together","Michael Goodwin says Donald Trump is a president who likes to make deals.Over nearly two decades, several Israeli leaders offered peace terms that included a Palestinian state. The offers were rejected, a rain of Arab rockets and terror attacks followed and across the Israeli political spectrum, there was one reaction: We don&#x2019;t have a partner for peace.President Trump knows the feeling.His&#xA0;remarks following the horrific attacks in El Paso and Dayton&#xA0;hit all the right notes. He forcefully condemned bigotry and white supremacy and touted measures aimed at flagging potential mass murderers before they get guns."
11,"Kent Ingle: After El Paso &amp; Dayton, here are 5 ways to process grief in the face of tragedy","One of the victims was 15-year-old Javier Rodriguez; Jeff Paul reports.After the shootings this weekend in Dayton, Ohio, and El Paso, Texas, it feels like our nation is under continuous attack -- under the attack of racism, hatred, and our right to human life.There was a time when we were so rattled by just one of these tragic events, let alone two. These shootings have seemed a recurring nightmare in our nation. When these events have become so frequent that they are white noise on the news, it is terrifying. It makes me stop and ask, &#x201C;Is this really our nation? Is this reckless chaos really happening in America?&#x201D; It has caused us more pain than sometimes feels bearable. Whether or not you were affected by the deaths of these shootings, they cause us to consider the fragility of life and the suffering so many are currently facing.There is no easy way to explain the purpose of suffering on this earth, especially when the pain from the loss of life runs deeper than most any of us can bear. It wasn&#x2019;t what God initially intended for us. God is the creator and giver of all things good and beautiful, but our world is broken and, as of late, truly horrific."
12,"Todd Starnes: Country music going liberal? Sweet mercy, let's hope it's not getting Dixie-Chick-a-fied","Country music singer Kacey Musgraves urged fans in Chicago to chant 'somebody f—king do something' following the mass shootings in Dayton, Ohio, and El Paso, Texas.I recently received a rather urgent telephone call from my beloved Aunt Lynn, the church pianist down at the Methodist church in Mississippi.&#x201C;Todd, what in the name of Minnie Pearl is going on with country music,&#x201D; she demanded to know. &#x201C;The girls in our Bible study class think they&#x2019;re going liberal.&#x201D;CLICK HERE TO PRE-ORDER TODD&#x2019;S EXPLOSIVE NEW BOOK, &#x201C;CULTURE JIHAD: HOW TO STOP THE LEFT FROM KILLING A NATION.&#x201D;"
13,"Dan Gainor: The New York Times changes its headline, caves to the mob and shows it has lost its mind","New York Times changes headline after being considered 'problematic'; former Clinton adviser Mark Penn reacts.It&#x2019;s rough being the second-most liberal newspaper in the U.S. Mistakenly cover a news story with an accurate &quot;head&quot; and the left is calling for yours.The headline was simple &#x2014; five controversial words that went global almost as soon as they hit Twitter. 538&#x2019;s Editor-in-Chief Nate Silver deadpanned over a copy of the front page: &#x201C;Tomorrow&apos;s NYT print edition. Not sure &#x2018;TRUMP URGES UNITY VS. RACISM&#x2019; is how I would have framed the story.&#x201D;Liberals couldn&#x2019;t make heads or tails of it, so they went insane. Democratic presidential candidates lined up to whine that The Times wasn&#x2019;t as reliably left-wing as they demanded."
14,Alfredo Ortiz: In the Trump economy small businesses are thriving -- So why are Dems working to undermine it?,"White House trade adviser Peter Navarro addresses the intensifying trade tensions on 'America's Newsroom' after the Dow's worst trading day of the year.It&#x2019;s a sad fact but many national news outlets blatantly ignore how President Trump has done a great deal to revive and grow the economy and help small businesses prosper by increasing access to affordable, reliable energy.Under President Trump, the U.S. is experiencing record-low unemployment and rising wages the previous administration repeatedly said wasn&#x2019;t possible. As a result, small businesses are hiring at a record pace and President Trump&#x2019;s goal of energy dominance has played a big part in this economic expansion. Rather than restrict energy production, Trump policies are creating record production of oil and natural gas, which in turn are stabilizing energy prices and costs for companies.These stable or reduced fuel costs are especially beneficial to small businesses which are responsible for creating 62 percent&#xA0;of the jobs in the American economy. When small business owners pay less to power their operations or transport goods, they can grow, they can hire more people or pay higher wages to existing employees."
15,"Tucker Carlson: The left demands conformity, will use threats to keep people in line until the next election","Mob threatens Mitch McConnell outside his home in wake of mass shootings.&quot;Gun control saves lives.&quot; That&apos;s what they&apos;re telling you day and night on CNN. In fact, they&apos;re having a town hall meeting on Wednesday to tell you some more.Anyone who opposes gun control, they&apos;ll tell you by implication of - not directly - is a bad person, a callous, cruel, probably violent, person. Somebody who doesn&apos;t care about the safety of others.Well, on Monday night, a group of progressive activists took that very message to Senate Majority Leader Mitch McConnell&apos;s home. &quot;Stab him in the heart. Break his neck.&quot; That was one of the messages for Mitch McConnell. They&apos;re totally opposed to violence, and that&apos;s why they want to kill Mitch McConnell."
16,Gil Barndollar: War with Iran would be foolish – Our relations will improve in the long run,"Iranian President Hassan Rouhani says ships passing through the Strait of Hormuz may not be safe; Ellison Barber has the details.Despite increasingly bellicose rhetoric and a mounting tally of incidents, the United States and Iran have avoided war so far. Yet voices on both sides &#x2013; many of them at the highest levels of government &#x2013; are arguing that we should give war a chance.There are plenty of reasons why even a supposedly limited war with Iran is a bad idea. Chief among them are the nearly-guaranteed risks of escalation, the broader regional impact of a conflict, and the potential for chaos should the Iranian theocracy suddenly implode.But the strongest argument against U.S. escalation is oddly absent from the discussion: Why should the United States risk war &#x2013; with all of its unknowable consequences and chaos &#x2013; when the key trends in Iran are moving in America&#x2019;s favor?"
17,Samantha Nerove: Why so many mass murders? Study impact of violent video games and impose age restrictions,"Rod 'Slasher' Breslau says politicians are perpetuating the myth that games inspire young Americans to commit violent acts.War is ugly and a nightmare to experience &#x2013; neither glamorous nor enjoyable. It&#x2019;s nothing like the violent video games that allow players to happily &#x201C;kill&#x201D; animated figures from the safety of their bedrooms. As a combat veteran of two wars, I&#x2019;ve seen the terrible human cost of violence close up &#x2013; badly wounded fellow soldiers, others killed in the prime of life, enemy combatants burned beyond recognition. Destroyed homes, businesses and schools.Now violent video games are in the news as a possible contributing factor to mass murders here in the U.S., following the horrific weekend massacres in El Paso, Texas and Dayton, Ohio that claimed the lives of 31 people."
18,"Jason Chaffetz: To stop more shootings, stop erasing criminal records of juveniles prone to violence","After the mass shooting in Dayton, Ohio, Fox News contributor Jason Chaffetz argues that law enforcement should have access to juvenile records to prevent more violence.The mass shooter in Dayton, Ohio who was killed by police early Sunday after he shot nine people to death and wounded more than a dozen fit the now-familiar profile of the troubled youth with a well-documented history of threats dating back to high school.The Dayton gunman had a &quot;kill list&quot; and had interacted with law enforcement as a minor, authorities said.Similarly, the man charged with killing 17 people and wounding 17 others at Marjory Stoneman Douglas High School in Parkland, Fla., last year was also well known to high school counselors and local police before he turned 18, police said."
19,Gutfeld on media coverage of the mass shootings,"Press prioritizes some shootings over others for coverage.A headline on a Boston Globe editorial says: &#x201C;The hypocrite in chief takes on domestic terror.&quot; But even if President Trump were a hypocrite, he&apos;d be doing more to take on &quot;domestic terror&quot; than the Boston Globe or any of its siblings in New York, San Francisco or&#xA0;Los Angeles. Want proof? Read the papers.The Globe is talking about the El Paso story&#xA0;because it&apos;s a horrible,&#xA0;mass public shooting, but also because the shooter fits the media&apos;s desired profile."
20,"Bradley Blakeman: It's time for gun safety, increased mental health care – Let's come together America","The 'Outnumbered' panel reacts to the political divisiveness coming from Democrats in the aftermath of the tragedies in Texas and Ohio.Now is the time for our nation to come together and tackle gun safety and mental health screening and treatment in a meaningful way.There are an estimated 300 million+ firearms in America today. It is unreasonable and more importantly unconstitutional to confiscate weapons out of hand. But, it is reasonable and constitutional to regulate them.Now is the time to institute national and uniform background checks prior to the purchase of firearms. We must change and close loopholes that cover gun-shows and person to person sales."
21,"Gary Brubaker: El Paso, Dayton -- 'Monopoly' doesn't create slumlords. Video games don't school sociopaths","Rod 'Slasher' Breslau says politicians are perpetuating the myth that games inspire young Americans to commit violent acts.Personally and corporately as a nation, we recoil in horror and grief at the continued gun violence in the United States.Politicians want to seek solutions that will make a meaningful difference. A number of our national and state leaders allege that playing video games can change people into criminals capable of carrying out mass shootings.&#xA0;The theory being that playing video games can cause psychological breaks in otherwise non-violent individuals. That violent video games not only train people for murder, but create sociopaths. Therefore, violent video games are a root cause of our prolonged nightmare of large-scale shootings.I have been a video game developer for over two decades and have been a faculty member at the world&#x2019;s leading video game development graduate program, SMU Guildhall in Dallas, for over a decade. I have been on teams that authored best-selling titles and have taught current leaders in the industry at the graduate level."
22,"WSJ: The Dayton killer was a left-winger, but don't blame Elizabeth Warren","The gunman killed nice people in 30 seconds before officers killed him; Mike Tobin reports.Police in Dayton say they&#x2019;re still seeking a motive for Connor Betts&#x2019; shooting spree that killed nine people, including his sister. But whatever turns up, we hope no one blames Elizabeth Warren.We say that because the news site Heavy.com, which gained access to Betts&#x2019; Twitter account before it was taken down, reports that his politics appear to have been left of center. The shooter recently tweeted that he would &#x201C;happily&#x201D; vote for Senator Warren. His Twitter profile also read: &#x201C;he/him/anime fan/metalhead/leftist/i&#x2019;m going to hell and i&#x2019;m not coming back.&#x201D; In December last he wrote: &#x201C;This is America: Guns on every corner, guns in every house, no freedom but to kill.&#x201D; A month before that, he wrote: &#x201C;Vote blue for gods sake.&#x201D;The Dayton shooter’s leftist ravings are notable only because the media and Democratic politicians have drawn a straight line between the El Paso shooter’s anti-immigrant “manifesto” and Donald Trump and the Republican Party.CLICK HERE TO GET THE FOX NEWS APP"
23,"Daniel Turner, Kent Lassman: Green New Deal is no deal at all – We know because we studied it","Power the Future says the progressive policy will cost households at least $70,000 in the first year.When Rep. Alexandria Ocasio-Cortez, D-N.Y.,&#xA0;and Sen.&#xA0;Ed Markey, D-Mass.,&#xA0;unveiled the Green New Deal in February, they instantly changed the conversation on environmental policy. What in times past would be generally perceived as an intrusive, radically transformative proposal is now the center of Democratic Party&apos;s platform.Power the Future and the Competitive Enterprise Institute have released a joint study showing households in five states can expect tens of thousands of dollars in higher costs for energy, housing, transportation, and shipping if this proposal is implemented.Despite the astronomical costs, many of the 2020 Democratic presidential candidates have endorsed the proposal, claiming the radical blueprint to ration energy and transform our economy is exactly what America needs. No longer is it &#x201C;climate change&#x201D; but &#x201C;climate emergency&#x201D; or even &#x201C;climate crisis.&#x201D; As such, small measures are unwelcome to Green New Deal supporters. Only the most radical environmental proposals, paired with a liberal wish list including single-payer health care, a jobs program, and decarbonization of the economy within a decade could possibly be enough."
24,Christen Limbaugh Bloom: 'Bachelorette' Hannah Brown deserves the most praise for THIS,"The popular ABC show's star, Hannah Brown, made a remark about her relationship with Jesus in spite of having pre-marital sex. The remark ignited controversy between her and one of the contestants, Luke Parker, who has also been open about being a Christian.ABC&#x2019;s hit reality series &#x201C;The Bachelorette&#x201D; wrapped up last week. Many people, including host Chris Harrison, labeled it the &#x201C;most dramatic season&#x201D; in the show&#x2019;s history.Bachelorette Hannah Brown won the admiration of countless viewers for her strength amidst several controversies both during and after her season on the show.After watching her journey from start to finish, I believe there was one particular moment when she truly shined--and my choice is probably not a popular opinion."
25,Bradley Blakeman: Iran has been hostile to ships near the Strait of Hormuz – It's time for THIS solution,"The oil tankers, operated by British companies, were seized in international waters.The use of decoys has been used with great success to fool an enemy or deter an enemy from attacking what could be a trap or a trick.Who could forget the most famous decoy in war &#x2013; the Trojan Horse &#x2013; a giant hollow wooden horse used by the Greeks to fool the Trojans. The Horse was left at the gates of Troy as an offering of peace to the goddess Athena the goddess of war. After the horse was left at the gates of Troy, the Greeks retreated. Thereafter, the Trojans moved the horse inside the gates of Troy only to find that the horse was chock full of Greek &#x201C;special forces&#x201D; who exited the horse at dark, opened the gates of Troy and let in the Greek army who overwhelmed the Trojans and captured the city.Fast forward to 1942. The Army built a decoy airfield in Virginia to fool the Nazi Luftwaffe. It was constructed in response to the fear of an attack by ever-increasing long-range bombers. What the phony airfield concealed was batteries of anti-aircraft weapons."
